{
  "command": "sizer.plan.local-ai-balanced",
  "data": {
    "authorization_receipts": [],
    "blockers": [
      {
        "code": "F100_C0_MISSING",
        "message": "Capacity reserves are not frozen; the plan cannot be executed."
      },
      {
        "code": "NO_QUALIFIED_SELECTION",
        "message": "No qualified model profile is selected by this fixture."
      }
    ],
    "capacity_contract_status": "missing",
    "confirmation": {
      "granted": false,
      "required": true
    },
    "executable": false,
    "items": [],
    "operation": "plan",
    "plan_id": "fixture:blocked-plan",
    "preset": "local-ai-balanced",
    "schema": "plebian.models.install-plan/v1",
    "status": "blocked",
    "totals": {
      "download_bytes": null,
      "installed_bytes": null,
      "shared_bytes": null,
      "temporary_bytes": null
    }
  },
  "schema": "plebian.cli.response/v1",
  "status": "blocked",
  "warnings": []
}
