{
  "command": "sizer.install",
  "data": {
    "authorization_receipt_sha256s": [],
    "blockers": [
      {
        "code": "F100_C0_MISSING",
        "message": "Capacity reserves are not frozen; installation was not started."
      },
      {
        "code": "NO_QUALIFIED_SELECTION",
        "message": "No qualified model profile is selected by this fixture."
      }
    ],
    "cancelable": false,
    "item_results": [],
    "operation": "install",
    "plan_id": "fixture:blocked-plan",
    "plan_sha256": "bdf8e8d9afb0fac85b252a5d63f78507bc03b2ef9ed25cac9926ef7641d7a317",
    "progress": {
      "active_artifact_id": null,
      "completed_items": 0,
      "phase": "none",
      "total_items": 0
    },
    "resumable": false,
    "retry_policy": "same-plan-and-receipts-resume-or-return-terminal",
    "schema": "plebian.models.install-transaction/v1",
    "state": "blocked",
    "terminal": true,
    "transaction_id": null
  },
  "schema": "plebian.cli.response/v1",
  "status": "blocked",
  "warnings": []
}
